{
 "$schema": "./batteries.schema.json",
 "version": 1,
 "license": "CC0-1.0",
 "updated": "2026-10-27",
 "sources": {
  "eq3-site": {
   "name": "homematic-ip.com product pages (eQ-3 AG), field 'Versorgungsspannung'",
   "url": "https://homematic-ip.com/de/produkte",
   "license": "facts from the manufacturer's data; no text reproduced beyond the supply line",
   "kind": "manufacturer",
   "read": "2026-10-27"
  },
  "eq3-manual": {
   "name": "eQ-3 installation and operating manual (Technische Daten)",
   "url": "https://www.eq-3.de/service/downloads.html",
   "license": "facts from the manufacturer's manual; the supply line is quoted",
   "kind": "manufacturer",
   "read": "2026-10-27"
  },
  "elv-manual": {
   "name": "eQ-3 manual or datasheet as hosted by ELV (media.elv.com)",
   "url": "https://de.elv.com",
   "license": "facts from the manufacturer's manual; the supply line is quoted",
   "kind": "manufacturer",
   "read": "2026-10-27"
  },
  "battery-notes": {
   "name": "Home Assistant Battery Notes, library/library.json",
   "url": "https://github.com/andrew-codechimp/HA-Battery-Notes/blob/main/library/library.json",
   "license": "MIT (Copyright (c) 2023-2025 Andrew Jackson)",
   "kind": "prior-art",
   "read": "2026-10-27",
   "note": "commit ef1809cc, 2026-10-26"
  },
  "aiohomematic": {
   "name": "aiohomematic, aiohomematic/model/calculated/operating_voltage_level.py (_BATTERY_DATA)",
   "url": "https://github.com/SukramJ/aiohomematic/blob/main/aiohomematic/model/calculated/operating_voltage_level.py",
   "license": "MIT",
   "kind": "prior-art",
   "read": "2026-10-27",
   "note": "the table behind homematicip_local's operating-voltage-level sensor; prefix matching"
  },
  "openhab": {
   "name": "openHAB Homematic binding, src/main/resources/homematic/batteries.properties",
   "url": "https://github.com/openhab/openhab-addons/blob/main/bundles/org.openhab.binding.homematic/src/main/resources/homematic/batteries.properties",
   "license": "EPL-2.0",
   "kind": "prior-art",
   "read": "2026-10-27"
  },
  "iobroker-servicemeldungen": {
   "name": "ioBroker script Servicemeldungen-Homematic (Baenker), func_Batterie",
   "url": "https://github.com/Baenker/Servicemeldungen-Homematic/blob/master/Servicemeldungen.js",
   "license": "none stated (all rights reserved by default): used only as a cross-check, never as a row's only source",
   "kind": "prior-art",
   "read": "2026-10-27"
  },
  "corpus": {
   "name": "hm-simulator device corpus, data/paramset-descriptions.json (descriptions read from real devices)",
   "url": "https://github.com/hobbyquaker/hm-simulator",
   "license": "MIT",
   "kind": "corpus",
   "read": "2026-10-27",
   "note": "LOW_BAT_LIMIT defaults and which battery datapoints a type has"
  },
  "classification": {
   "name": "device class by model name and description (actuators on 230 V, DIN-rail, plug-in, wired bus)",
   "url": "https://github.com/hobbyquaker/homematic-manager",
   "license": "model names only",
   "kind": "corpus",
   "read": "2026-10-27",
   "note": "homematic-manager's device data (openccu-data model names and descriptions)"
  }
 },
 "types": {
  "AA": {
   "iec": "LR6",
   "names": [
    "Mignon",
    "R6"
   ],
   "nominal_v": 1.5,
   "chemistry": "alkaline"
  },
  "AAA": {
   "iec": "LR03",
   "names": [
    "Micro",
    "R03"
   ],
   "nominal_v": 1.5,
   "chemistry": "alkaline"
  },
  "C": {
   "iec": "LR14",
   "names": [
    "Baby",
    "R14"
   ],
   "nominal_v": 1.5,
   "chemistry": "alkaline"
  },
  "D": {
   "iec": "LR20",
   "names": [
    "Mono",
    "R20"
   ],
   "nominal_v": 1.5,
   "chemistry": "alkaline"
  },
  "9V": {
   "iec": "6LR61",
   "names": [
    "E-Block",
    "PP3"
   ],
   "nominal_v": 9.0,
   "chemistry": "alkaline"
  },
  "LR44": {
   "iec": "LR44",
   "names": [
    "AG13",
    "A76"
   ],
   "nominal_v": 1.5,
   "chemistry": "alkaline-button"
  },
  "CR2016": {
   "iec": "CR2016",
   "nominal_v": 3.0,
   "chemistry": "lithium-coin"
  },
  "CR2032": {
   "iec": "CR2032",
   "nominal_v": 3.0,
   "chemistry": "lithium-coin"
  },
  "CR2450": {
   "iec": "CR2450",
   "nominal_v": 3.0,
   "chemistry": "lithium-coin"
  },
  "CR123A": {
   "iec": "CR17345",
   "nominal_v": 3.0,
   "chemistry": "lithium"
  },
  "fixed": {
   "names": [
    "built in, not replaceable"
   ],
   "nominal_v": 3.0,
   "chemistry": "lithium",
   "replaceable": false
  },
  "pack": {
   "names": [
    "a device-specific rechargeable pack"
   ],
   "nominal_v": 3.6,
   "chemistry": "nimh"
  },
  "lead12V": {
   "names": [
    "12 V lead-acid"
   ],
   "nominal_v": 12.0,
   "chemistry": "lead"
  }
 },
 "chemistries": {
  "alkaline": {
   "fresh": 1.48,
   "low": 1.1,
   "step": 0.12,
   "note": "a fresh cell reads 1.5-1.6 V; 2 cells: fresh 2.95 V, step 0.25 V (the detection rules, docs/detection.md)"
  },
  "alkaline-button": {
   "fresh": 1.48,
   "low": 1.2,
   "step": 0.1,
   "note": "LR44: small capacity, flat curve until a late knee (assumed)"
  },
  "lithium-coin": {
   "fresh": 2.95,
   "low": 2.4,
   "step": 0.15,
   "note": "CR20xx: 3.0-3.2 V fresh, 2.4 V is HmIP's default limit (FCI1)"
  },
  "lithium": {
   "fresh": 2.95,
   "low": 2.5,
   "step": 0.15,
   "note": "3 V lithium (CR123A, fixed smoke-alarm cells)"
  },
  "lithium-aa": {
   "fresh": 1.7,
   "low": 1.2,
   "step": 0.1,
   "note": "Li-FeS2 AA/AAA (Energizer Ultimate): 1.7-1.8 V fresh; set per device by the user"
  },
  "nimh": {
   "fresh": 1.33,
   "low": 1.1,
   "step": 0.06,
   "note": "NiMH: 1.35-1.4 V fresh off the charger, flat curve; 2 cells: fresh 2.6 V, step 0.12 V"
  },
  "lead": {
   "fresh": 2.1,
   "low": 1.75,
   "step": 0.08,
   "note": "per cell of a 12 V lead pack (6 cells): 12.6 V full, HM-Sec-SFA-SM's limit 10.5 V"
  }
 },
 "models": {
  "ALPHA-IP-RBG": {
   "power": "battery",
   "family": "HmIP-RF",
   "slots": [
    {
     "count": 2,
     "type": "AAA"
    }
   ],
   "confidence": "assumed",
   "note": "only the unlicensed ioBroker script names it; re-derive from the manual",
   "sources": [
    {
     "id": "iobroker-servicemeldungen",
     "says": "2x AAA"
    }
   ]
  },
  "ELV-SH-CTH": {
   "power": "battery",
   "family": "HmIP-RF",
   "slots": [
    {
     "count": 1,
     "type": "CR2032"
    }
   ],
   "confidence": "prior-art",
   "sources": [
    {
     "id": "battery-notes",
     "says": "1x CR2032"
    },
    {
     "id": "aiohomematic",
     "says": "1x CR2032"
    }
   ]
  },
  "ELV-SH-SMSI": {
   "power": "battery",
   "family": "HmIP-RF",
   "slots": [
    {
     "count": 2,
     "type": "AA"
    }
   ],
   "confidence": "manufacturer",
   "sources": [
    {
     "id": "elv-manual",
     "url": "https://media.elv.com/file/161792_um.pdf",
     "quote": "2x 1,5 V LR6/Mignon/AA"
    }
   ]
  },
  "ELV-SH-SW1-BAT": {
   "power": "battery",
   "family": "HmIP-RF",
   "slots": [
    {
     "count": 2,
     "type": "AA"
    }
   ],
   "confidence": "single-source",
   "sources": [
    {
     "id": "aiohomematic",
     "says": "2x AA"
    }
   ]
  },
  "ELV-SH-TACO": {
   "power": "battery",
   "family": "HmIP-RF",
   "slots": [
    {
     "count": 1,
     "type": "AAA"
    }
   ],
   "outdoor": true,
   "confidence": "single-source",
   "sources": [
    {
     "id": "aiohomematic",
     "says": "1x AAA"
    }
   ]
  },
  "ELV-SH-WSM": {
   "power": "battery",
   "family": "HmIP-RF",
   "slots": [
    {
     "count": 2,
     "type": "AA"
    }
   ],
   "confidence": "prior-art",
   "sources": [
    {
     "id": "battery-notes",
     "says": "2x AA"
    },
    {
     "id": "aiohomematic",
     "says": "2x AA"
    }
   ]
  },
  "HBW-LC-RGBWW-IN6-DR": {
   "power": "bus",
   "family": "BidCos-RF",
   "confidence": "assumed",
   "sources": [
    {
     "id": "classification",
     "says": "wired bus device (24 V bus supply)"
    }
   ]
  },
  "HBW-LC4-IN4-DR": {
   "power": "bus",
   "family": "BidCos-RF",
   "confidence": "assumed",
   "sources": [
    {
     "id": "classification",
     "says": "wired bus device (24 V bus supply)"
    }
   ]
  },
  "HM-CC-RT-DN": {
   "power": "battery",
   "family": "BidCos-RF",
   "slots": [
    {
     "count": 2,
     "type": "AA"
    }
   ],
   "voltage": {
    "dp": "4/BATTERY_STATE",
    "low": 2.1
   },
   "low_bat_limit": 2.1,
   "life_years": 1.5,
   "aliases": [
    "HM-CC-RT-DN-BoM"
   ],
   "confidence": "manufacturer",
   "sources": [
    {
     "id": "eq3-manual",
     "url": "https://www.eq-3.de/Downloads/eq3/downloads_produktkatalog/homematic/bda/HM-CC-RT-DN_UM_GE_eQ-3_web.pdf",
     "quote": "2x 1,5V LR6/Mignon/AA"
    },
    {
     "id": "corpus",
     "says": "BATTERY_STATE, LOWBAT; LOW_BAT_LIMIT 2.1"
    },
    {
     "id": "battery-notes",
     "says": "2x AA"
    },
    {
     "id": "aiohomematic",
     "says": "2x AA"
    },
    {
     "id": "openhab",
     "says": "2x AA"
    },
    {
     "id": "iobroker-servicemeldungen",
     "says": "2x AA"
    }
   ]
  },
  "HM-CC-TC": {
   "power": "battery",
   "family": "BidCos-RF",
   "slots": [
    {
     "count": 2,
     "type": "AA"
    }
   ],
   "voltage": null,
   "confidence": "prior-art",
   "sources": [
    {
     "id": "battery-notes",
     "says": "2x AA"
    },
    {
     "id": "openhab",
     "says": "2x AA"
    },
    {
     "id": "iobroker-servicemeldungen",
     "says": "2x AA"
    },
    {
     "id": "corpus",
     "says": "LOWBAT"
    }
   ]
  },
  "HM-CC-VD": {
   "power": "battery",
   "family": "BidCos-RF",
   "slots": [
    {
     "count": 2,
     "type": "AA"
    }
   ],
   "voltage": null,
   "confidence": "prior-art",
   "sources": [
    {
     "id": "battery-notes",
     "says": "2x AA"
    },
    {
     "id": "openhab",
     "says": "2x AA"
    },
    {
     "id": "iobroker-servicemeldungen",
     "says": "2x AA"
    },
    {
     "id": "corpus",
     "says": "LOWBAT"
    }
   ]
  },
  "HM-Dis-EP-WM55": {
   "power": "battery",
   "family": "BidCos-RF",
   "slots": [
    {
     "count": 2,
     "type": "AAA"
    }
   ],